{
 "format": "spyder-bone/bands",
 "format_version": 2,
 "id": "bands.core",
 "version": "2.0.0",
 "engine_min": "1.0",
 "status": "active",
 "licence": "CC-BY-4.0",
 "created": "2026-10-19",
 "title": "Shared band table: centres, weights, faint thresholds, kernels and readability windows",
 "description": "One table for every consumer of band readings (organic-evidence levels, ZooMS pattern, C1, close-ups). A reading r_b = mean of E over centre +- half_width_nm, E = scale x Savitzky-Golay derivative of absorbance (kernel 'e31'). u_b = r_b / weight. Band readability is ONE gate per band, shared by the evidence levels and the ZooMS pattern (so a close-up always matches the call): readable unless SD_E > 0.25 x weight and r_b < 1.5 x weight (thresholds owned by the rule files). SD_E = gain x envelope_factor x N2(readability noise window) on the AS-MEASURED scan; the engine computes the gain (format 2) from the band's plain kernel (a projection is ignored), the correction actually applied to the stream (its blur and absorbance gain per detector segment, linearised) and the scan's own detector joins, under noise_model. When the gain cannot be computed (a non-linear correction; a kernel or noise window not inside one detector segment of the scan: not available on this instrument) or N2 is not finite, SD_E is +infinity: the band is unreadable unless strong, and the result says the band noise is unknown. A band with a 'projection' is read on that projection's corrected E (see 'projections'); u_b = u_sign x r_b / weight (u_sign -1: a trough, more collagen = more negative E; default +1).",
 "kernels": {
  "e31": {
   "absorbance_clip_min": 1e-06,
   "savgol": {
    "window": 31,
    "polyorder": 3,
    "deriv": 2,
    "delta": 1.0,
    "mode": "zero_edges"
   },
   "scale": -100000.0,
   "consumers": [
    "evidence levels",
    "ZooMS pattern",
    "C1",
    "B9 (profile)",
    "close-ups"
   ]
  },
  "warn17": {
   "absorbance_clip_min": 0.001,
   "savgol": {
    "window": 17,
    "polyorder": 2,
    "deriv": 2,
    "delta": 1.0,
    "mode": "interp"
   },
   "scale": -100000.0,
   "consumers": [
    "plaster, wax, ester and heat signs (their own parameter files)"
   ]
  }
 },
 "n2": {
  "definition": "canonical N2 (reference/spyder_ref/n2.py): A = log10(1/max(R, 1e-4)) on the full as-measured grid; second difference centred on each channel; centres lo <= lambda < hi; 1.4826 x MAD; units 1e-5",
  "measured_on": "the AS-MEASURED scan, never the transferred stream"
 },
 "noise_model": {
  "correlation_nm": 1.25,
  "description": "white noise in absorbance smoothed by a Gaussian of this sigma (nm), independent between detector segments (the ASD files' own residual autocorrelation); taps to +-8 sigma. A correction file may give its instrument's own value in provenance.instrument_noise.correlation_nm, measured on that instrument's scans (another instrument, or a resampled grid, has its own)."
 },
 "projections": {
  "oh1500": {
   "description": "x = E / kernel scale over window_nm (the SG31 cubic second derivative of absorbance, model units); x' = x - v (v . (x - c)); E' = kernel scale x x'. A band naming this projection is read as the mean of E' over centre +- half_width_nm.",
   "window_nm": [
    1500,
    1550
   ],
   "kernel": "e31",
   "direction": [
    0.034264171825867634,
    0.044576735641075046,
    0.05447535094410149,
    0.06394707105881073,
    0.07316807386783357,
    0.08195375981078203,
    0.09045239910684541,
    0.09865829074944829,
    0.10645858633671972,
    0.11366673145981666,
    0.12035388241931817,
    0.1265457612473995,
    0.13216377963295872,
    0.13707358648451243,
    0.14141656581770645,
    0.14520197969278748,
    0.1484018215590111,
    0.15098156031366275,
    0.1531403849990644,
    0.15496162602186844,
    0.15650959110443172,
    0.15765365485460034,
    0.15855353683406342,
    0.15917136970340412,
    0.15954592436870885,
    0.15964203532126395,
    0.1593914772031414,
    0.1591144617796371,
    0.15876866239317305,
    0.15824063399272825,
    0.15757584558739535,
    0.1569044222986692,
    0.1562377833414483,
    0.15547539199524688,
    0.15470745375616496,
    0.15405843543628558,
    0.15351504112182135,
    0.15298654097418837,
    0.15244149802212545,
    0.15200744865939442,
    0.15173482383509795,
    0.15146039037184203,
    0.15107745953878185,
    0.15070070988846498,
    0.1502641636582173,
    0.14960590766162282,
    0.14882182618673687,
    0.14801572475975175,
    0.1471456980038108,
    0.14622660430022222,
    0.14532352405688712
   ],
   "centre": [
    -8.74024212561309e-06,
    -7.491525716064354e-06,
    -6.2389032557137025e-06,
    -5.003700215654603e-06,
    -3.8111420073054645e-06,
    -2.698308545291324e-06,
    -1.6720351609979163e-06,
    -7.577661686090895e-07,
    3.0875193391835154e-08,
    6.609553967213031e-07,
    1.1432101440831927e-06,
    1.4597374098127055e-06,
    1.6141844047739803e-06,
    1.5798519328033276e-06,
    1.3695621544178607e-06,
    1.002477705926417e-06,
    4.95275212104442e-07,
    -1.3912273054530715e-07,
    -8.73671655578982e-07,
    -1.6531014731106772e-06,
    -2.457720547701174e-06,
    -3.246405774668618e-06,
    -3.979634528989462e-06,
    -4.587691689475364e-06,
    -5.061124767294441e-06,
    -5.338538395364683e-06,
    -5.407593563234572e-06,
    -5.204713338032258e-06,
    -4.728796183344152e-06,
    -3.959791980595734e-06,
    -2.8947736411010474e-06,
    -1.5198569377449784e-06,
    1.4465550509511407e-07,
    2.0576500594487458e-06,
    4.201258082667064e-06,
    6.51949466642904e-06,
    8.983146296791147e-06,
    1.1493366829042592e-05,
    1.4019373404297316e-05,
    1.646176764958246e-05,
    1.8780873207827165e-05,
    2.0865426605383195e-05,
    2.268162546977512e-05,
    2.4151361139854624e-05,
    2.525671971307566e-05,
    2.5942522780682615e-05,
    2.6185783579595714e-05,
    2.59981951324748e-05,
    2.5384333232185755e-05,
    2.4368468508885524e-05,
    2.2960866394686477e-05
   ],
   "source": {
    "direction": "the altered OH / bound-water direction of the OH-corrected 1500 nm model (recovered from public data; unit length)",
    "model_id": "collagen.spyder.1500_oh_corrected",
    "model_version": "1.0.0",
    "model_sha256": "07b4709f825b89c1f56cad44d22f35d47a55183ab9554f540f484712154b5541",
    "centre": "the model's regression.x_center"
   }
  }
 },
 "bands": {
  "CH1689": {
   "centre_nm": 1689,
   "half_width_nm": 2,
   "kernel": "e31",
   "detector": "SWIR1",
   "roles": [
    "evidence_core",
    "zooms_ch"
   ],
   "weight": 0.85,
   "faint_u": 0.0,
   "noise_window_nm": [
    1500,
    1600
   ],
   "readability": {
    "noise_window_nm": [
     1500,
     1600
    ],
    "envelope_factor": 1.52,
    "envelope_provenance": "phase 0c h05/h14: within-detector noise envelope (Monte Carlo with the real high-resolution wavelength envelope / the shipped gain; nearly identical for every transfer key); same-bone scatter of a high-resolution variation set consistent (C-H 1.8-2.4x the uncorrected prediction, an upper bound). A default for any correction; an instrument may carry its own factors in the correction file's provenance.instrument_noise.ch_envelope_factors (the median 4th-difference noise ratio over at least 10 of its scans), never one per scan.",
    "provisional": true,
    "note": "SD_E = gain x envelope_factor x N2(noise_window_nm) on the AS-MEASURED scan; the gain is computed for the correction applied to the stream the band is read on and the scan's own detector segments (format 2; format 1 listed it per transfer file)."
   }
  },
  "CH1728": {
   "centre_nm": 1728,
   "half_width_nm": 2,
   "kernel": "e31",
   "detector": "SWIR1",
   "roles": [
    "evidence_core",
    "zooms_ch",
    "c1_ch"
   ],
   "weight": 1.0,
   "faint_u": 0.5,
   "noise_window_nm": [
    1500,
    1600
   ],
   "readability": {
    "noise_window_nm": [
     1500,
     1600
    ],
    "envelope_factor": 1.72,
    "envelope_provenance": "phase 0c h05/h14: within-detector noise envelope (Monte Carlo with the real high-resolution wavelength envelope / the shipped gain; nearly identical for every transfer key); same-bone scatter of a high-resolution variation set consistent (C-H 1.8-2.4x the uncorrected prediction, an upper bound). A default for any correction; an instrument may carry its own factors in the correction file's provenance.instrument_noise.ch_envelope_factors (the median 4th-difference noise ratio over at least 10 of its scans), never one per scan.",
    "provisional": true,
    "note": "SD_E = gain x envelope_factor x N2(noise_window_nm) on the AS-MEASURED scan; the gain is computed for the correction applied to the stream the band is read on and the scan's own detector segments (format 2; format 1 listed it per transfer file)."
   }
  },
  "NH2044": {
   "centre_nm": 2044,
   "half_width_nm": 2,
   "kernel": "e31",
   "detector": "SWIR2",
   "roles": [
    "evidence_extra",
    "evidence_nh_type",
    "zooms_protein",
    "c1_nh"
   ],
   "weight": 1.6,
   "noise_window_nm": [
    2000,
    2100
   ],
   "readability": {
    "noise_window_nm": [
     2000,
     2100
    ],
    "note": "SD_E = gain x envelope_factor x N2(noise_window_nm) on the AS-MEASURED scan; the gain is computed for the correction applied to the stream the band is read on and the scan's own detector segments (format 2; format 1 listed it per transfer file)."
   }
  },
  "AM2175": {
   "centre_nm": 2175,
   "half_width_nm": 2,
   "kernel": "e31",
   "detector": "SWIR2",
   "roles": [
    "evidence_core",
    "evidence_nh_type",
    "zooms_protein",
    "c1_nh"
   ],
   "weight": 1.1,
   "faint_u": 0.0,
   "noise_window_nm": [
    2000,
    2100